source_id,title_he,year,author_org_he,filename,char_count,scope_he,role_in_context,quality_note
RPT2021,"בקרת איכות מים במערך ניטור אזורי תעשייה באקויפר החוף 2021",2021,"אגף איכות מים — הרשות הממשלתית למים וביוב","בקרת איכות מים במערך ניטור אזורי תעשייה באקויפר החוף 2021.txt",144521,"כלל 18 אזורי תעשייה — פרק ייעודי חולון עמ' 29-35 (16 קידוחי ניטור + 9 קידוחי דלק אגד אזור)","baseline פרשני רשמי אחרון — מוקדים מוגדרים (תדירגן, תדיראן-קשר, תרשיש, חלק דרומי), אינדקסים פר-קידוח, סטטוס שיקום ISCO 2013-2020","אינדקסים בלבד (לא ריכוזים כמותיים); אין Mann-Kendall; PFAS לא נדגם; 1,4-דיאוקסן מצוין בנת חולון 1"
HST2007,"מיפוי התפרסות כתמי הזיהום באקוויפר חולון-בת ים: סקר היסטורי שלב א'+ב'",2007,"DHV MED / Ludan Engineering / EWRE עבור רשות המים","water-sources-status_tehom_Holon-BatYan-Dec2007.txt",340467,"חולון + בת ים — האקוויפר כולו; 12 מתחמי פוטנציאל זיהום גבוה ביותר","הסקר ההיסטורי המקיף ביותר — רשימת מקורות, שיא TCE 6457 µg/L בנת תדירגן (2005), 9 קידוחי הפקה שנפסלו, שקע הידרולוגי בת ים, ערוצי הסעה לא-נקודתיים","הדוח הרחב ביותר; ריכוזים מ-2005-2007 (predate ISCO 2013-2020); ספיקות שפכים פר-מפעל; נשאר רשימת אתרים שלא נסקרו"
ECO2012A,"מיפוי התפרסות כתמי זיהום באקוויפר חולון ובחינת חלופות לתפעול האקוויפר — חלק א'",2012,"אקולוג הנדסה בע""מ (9183-04)","water-sources-status_tehom_holon-part1.txt",130469,"אזה""ת חולון — 13 קידוחי ניטור חדשים שנקדחו במסגרת העבודה; מודל ממוחשב","מיפוי מערך מוסדר ראשון; ריכוזי 2009-2011 פר-קידוח (TCE/DCE/PCE/Cr); זיהוי 4 מוקדי זיהום מרכזיים; חתימות ריקבון ביולוגי DCE>TCE","שיא TCE 12,982 ppb בנת חולון 11; כרום 2,424 ppb בנת חולון 3; קידוחי ניטור הוצבו ליד מקור (selection bias)"
ECO2012B,"מיפוי מזהמים אקוויפר חולון — חלק ב' (תרחישי הפקה ונספחים)",2012,"אקולוג הנדסה בע""מ (9183-04)","water-sources-status_tehom_holon-part2.txt",41657,"אזה""ת חולון — תרחישי הפקה 0-3 לשנים 2008-2030 + 7 קידוחי ניטור מומלצים נוספים","תכנית פעולה — תרחיש 3 (אופטימיזציה) צופה סילוק 45% מסת TCE; חידוש שאיבת מק חולון 8 לטיוב; 4 קידוחי טיוב חדשים מתוכננים; 7 קידוחי ניטור נוספים מומלצים","אינו מאשר ביצוע בפועל; פערים: לא ברור איזה תרחיש בוצע; 7 קידוחי הניטור החדשים לא מופיעים ב-RPT2021"
ECO2009,"דו""ח מסכם — קידוח וניטור זיהום מתכות בין רימטל לבין מק חולון 5",2009,"אקולוג הנדסה בע""מ (9205)","water-sources-status_tehom_FinalReport-Holon.txt",179436,"מוקד נקודתי בלבד — מפעל רימטל/אר""ן מטל ברחוב המנור 54; קידוח ניטור חדש 200 מ' מקידוח הפקה מק חולון 5","מסלול ניקל 2005-2008 (0.6→0.78→2.0 mg/L); אלומיניום פי 7; ברזל פי 14; מק חולון 5 (קידוח שתייה) ניקל עלה 0.003→0.006 mg/L לאורך 22 שנה","סיכון מתפתח למק חולון 5; ההמלצה הייתה ניטור ולא הפסקת אספקה; אין ניטור פוסט-2009 בדוחות הזמינים"
WEB2026,"חיפוש מתקנים Holon — ממצאי Web 2022-2026",2026,"תקציר פנימי (web_findings.md, ינואר 2026)","web_findings.md",4734,"עדכוני סטטוס מפעלים 2022-2026 — gap post-PDF","אישור פעילות תדיראן-קשר (אלביט) ברחוב המרכבה 29 (~350 עובדים); מפעל נירוסטה בפינת פרופ' שור+הפלד בדרך להיסגר (יוני 2023, urban renewal); אפס מתקנים חדשים שזוהו","קצר; primarily for Source Candidates Pack (Step 3b); אינו מחליף PRTR/B144 פורמליים; אינו בודק בהק/תרשיש/גימת/כרומט"
